Cites,Authors,Title,Year,Source,Publisher,ArticleURL,CitesURL,GSRank,QueryDate,Type,DOI,ISSN,CitationURL,Volume,Issue,StartPage,EndPage,ECC,CitesPerYear,CitesPerAuthor,AuthorCount,Age,Abstract
0,"J Pontin, M Pontin, SL Huang, E Bear, K Liu, P McAuley…","Twelve Tomorrows",2018,"","books.google.com","https://books.google.com/books?hl=en&lr=&id=xN9iDwAAQBAJ&oi=fnd&pg=PT5&dq=survivability+filtering+facepiece+respirator&ots=xHN-PDZVWg&sig=oPjtAiZzLxT-tJFYmX5zeqyVV2s","",126,"2020-05-22 20:09:37","BOOK","","","",,,,,0,0.00,0,7,2,"Page 1. CIXIN KEN HUANG ELIZABETH CLIFFORD MALKA ALASTAIR LIU OLDER • PAUL V. JOHNSON REYNOLDS • • J. MC SARAH AULEY PINSKER • M. NNEDI LEDGARD OKORAFOR • PROFILE OF SAMUEL R. DELANY …"
0,"R Houston","Wheels Stop",2020,"","books.google.com","https://books.google.com/books?hl=en&lr=&id=iOvaDwAAQBAJ&oi=fnd&pg=PT7&dq=survivability+filtering+facepiece+respirator&ots=4-RdCMyG2Y&sig=PYXUU92RhCgtJX9F4tvA-gjmaso","",127,"2020-05-22 20:09:37","BOOK","","","",,,,,0,0.00,0,1,1,"Page 1. Wheels Stop Page 2. Rick hourlon fºllº lear tº Wheels Siop The Irogadies and Iriumphsº º ***-ºil º º - ---- A Page 3. © 2013 by the Board of Regents of the University of Nebraska All rights reserved Library …"
0,"D Trumbore, DJ Nelson","The Science of Breaking Bad",2019,"","books.google.com","https://books.google.com/books?hl=en&lr=&id=LnCbDwAAQBAJ&oi=fnd&pg=PR9&dq=survivability+filtering+facepiece+respirator&ots=b2SRDAhrcA&sig=mkSNqiXnwDQdJfsPJC6_LP_c8Nc","",128,"2020-05-22 20:09:37","BOOK","","","",,,,,0,0.00,0,2,1,"… The pants are soon run over by a recreational vehicle being driven reck- lessly by a middle-aged white man wearing only his wedding ring, under- wear, and a full-face respirator. His passenger, also wearing a face mask, is passed out in the front seat …"
14,"C Cussler","Dragon",2017,"","Hachette UK","","https://scholar.google.com/scholar?cites=3928973707961312721&as_sdt=2005&sciodt=0,5&hl=en",129,"2020-05-22 20:09:37","CITATION","","","",,,,,14,4.67,14,1,3,""
0,"B Alexander","Academia Next: The Futures of Higher Education",2020,"","books.google.com","https://books.google.com/books?hl=en&lr=&id=fJbFDwAAQBAJ&oi=fnd&pg=PR7&dq=survivability+filtering+facepiece+respirator&ots=54wXx7kWn6&sig=zCgK3JS0SoJGyd3qbAfd_MRc-0U","",130,"2020-05-22 20:09:37","BOOK","","","",,,,,0,0.00,0,1,1,"Page 1. Academia Next THE FUTURES OF HIGHER EDUCATION Bryan Alexander Page 2. Academia Next Page 3. This page intentionally left blank Page 4. Academia Next The Futures of Higher Education Bryan Alexander Johns Hopkins University Press Baltimore Page 5 …"
0,"C MacKenzie","Assessment of surgical performance",2016,"","spiral.imperial.ac.uk","https://spiral.imperial.ac.uk/handle/10044/1/55250","",131,"2020-05-22 20:09:37","","","","",,,,,0,0.00,0,1,4,"… ATLS at the point of injury together with standardized treatment and triage protocols. In comparing deaths from 2003 and 2004 to deaths in 2006 in the Iraqi conflicts (26), Kelly et al found 83% of potentially survivable injuries, were due to haemorrhage. Among these, 49% were …"
0,"R Ruebsamen, J Savoni, PK Hosseini, S Fuchs","Adolescent medicine and general paediatrics III Concurrent session Saturday, January 27, 2018",2018,"J Investig Med","jim.bmj.com","https://jim.bmj.com/content/66/1/219.abstract","",132,"2020-05-22 20:09:37","","","","",,,,,0,0.00,0,4,2,"Skip to main content. We use cookies to improve our service and to tailor our content and advertising to you. More info You can manage your cookie settings via your browser at any time. To learn more about how we use cookies, please see our cookies policy …"
1,"J Mayor, A Jacobson Eckert, A Richards","Supporting Cisco (Coregonus artedi) Restoration in the 1836 Treaty Waters of Lake Michigan",2018,"","deepblue.lib.umich.edu","https://deepblue.lib.umich.edu/handle/2027.42/143187","https://scholar.google.com/scholar?cites=5279986592175947687&as_sdt=2005&sciodt=0,5&hl=en",133,"2020-05-22 20:09:37","","","","",,,,,1,0.50,0,3,2,"… Compounding the oligotrophic effects of Dreissenid mussel filtering, Bythotrephes longimanus, a predatory cladoceran zooplankton, has lowered zooplankton abundances across the lake (Pothoven and Fahnenstiel 2014; Tuchman and Barbiero 2004) …"
0,"PC Guthrie","Modeling environmental impacts on cognitive performance for artificially intelligent entities",2017,"","Naval Postgraduate School …","","",134,"2020-05-22 20:09:37","CITATION","","","",,,,,0,0.00,0,1,3,""
0,"TLS Griffiths","A Rat Model of Volumetric Muscle Loss Repaired with Extracellular Matrix and Stem Cells",2016,"","search.proquest.com","http://search.proquest.com/openview/0c3893a1a4f709cd18c6a7e82b748992/1?pq-origsite=gscholar&cbl=18750&diss=y","",135,"2020-05-22 20:09:37","BOOK","","","",,,,,0,0.00,0,1,4,"… implantation into a large animal model is difficult.36,51 MPC can also be isolated from muscle digest and when transplanted may have better survivability than myoblast with better outcome and higher engraftment locally.42,53,54 …"
0,"MSO IRE","FIREFIGHTER FATALITY INVESTIGATIONS",2015,"","tdi.texas.gov","https://www.tdi.texas.gov/reports/fire/documents/fmloddannul16.pdf","",136,"2020-05-22 20:09:37","PDF","","","",,,,,0,0.00,0,1,5,"… education for HFD and other departments. Cadet Whitfield was in full Personal Protective Equipment (PPE) including a Self-Contained Breathing Apparatus (SCBA) and face-piece. Cadet Whitfield had completed the majority of the course and was between stations six and …"
