Cites,Authors,Title,Year,Source,Publisher,ArticleURL,CitesURL,GSRank,QueryDate,Type,DOI,ISSN,CitationURL,Volume,Issue,StartPage,EndPage,ECC,CitesPerYear,CitesPerAuthor,AuthorCount,Age,Abstract
1,"H Yu, N Afshar-Mohajer, AD Theodore…","An efficient virus aerosol sampler enabled by adiabatic expansion",2018,"Journal of Aerosol …","Elsevier","https://www.sciencedirect.com/science/article/pii/S0021850216303457","https://scholar.google.com/scholar?cites=3172388086007185001&as_sdt=2005&sciodt=0,5&hl=en",82,"2020-05-22 20:09:37","","","","",,,,,1,0.50,0,4,2,"… & Strauss, 1961). Since it does not infect humans and due to its robust survivability, MS2 is widely used as a surrogate in research of small airborne viruses (Dawson et al., 2005, Woo et al., 2010, Zuo et al., 2014). Prior to the …"
8,"DP Nolan","Loss prevention and safety control: terms and definitions",2016,"","books.google.com","https://books.google.com/books?hl=en&lr=&id=AdmKxSn00QgC&oi=fnd&pg=PP1&dq=survivability+filtering+facepiece+respirator&ots=nekdzzkO6R&sig=qJFFRrFIwkkXcZshaLtNC7XnuNk","https://scholar.google.com/scholar?cites=388501830956895533&as_sdt=2005&sciodt=0,5&hl=en",83,"2020-05-22 20:09:37","BOOK","","","",,,,,8,2.00,8,1,4,"… Activated charcoal is commonly used as a gas or vapor adsorbent in air purifying respirators and as a solid sorbent in air sampling. Activity Sampling A measurement technique for evaluating potential incident-producing behavior …"
3,"CA Garcia-Mochales","Concentration, size distribution, and control of swine viruses associated with airborne particles",2016,"","search.proquest.com","http://search.proquest.com/openview/3ce4bd52e9bef8e34cbc90d87c554888/1?pq-origsite=gscholar&cbl=18750&diss=y","https://scholar.google.com/scholar?cites=3207225587164387705&as_sdt=2005&sciodt=0,5&hl=en",84,"2020-05-22 20:09:37","","","","",,,,,3,0.75,3,1,4,"… There is an association between aerosol infectivity, virus survivability and aerosol particle size … filter. The composition of the microbial population in the air will be determined … conditioning (HVAC) filters has been successfully used for surveillance purposes (Goyal, et al., 2011) …"
0,"C Alonso Garcia-Mochales","Concentration, size distribution, and control of swine viruses associated with airborne particles",2016,"","conservancy.umn.edu","https://conservancy.umn.edu/handle/11299/181734","",85,"2020-05-22 20:09:37","","","","",,,,,0,0.00,0,1,4,"… There is an association between aerosol infectivity, virus survivability and aerosol particle size … filter. The composition of the microbial population in the air will be determined … conditioning (HVAC) filters has been successfully used for surveillance purposes (Goyal, et al., 2011) …"
0,"FVC Viçosa","Tomé, Hudson Vaner Ventura, 1985-T656i 2015",2015,"","locus.ufv.br","https://www.locus.ufv.br/bitstream/handle/123456789/6794/texto%20completo.pdf?sequence=1","",86,"2020-05-22 20:09:37","PDF","","","",,,,,0,0.00,0,1,5,"… of pathogens to the developing bees. i. Always wear clean nitrile disposable gloves and a face mask during material preparation. ii … b. The diet should be mixed together, using sterile laboratory tools and beakers. Filtering or heating is not necessary while preparing the diet …"
0,"KJ Saczalski, MN West…","Test Analysis of Youth and Adult Football Helmet Head Injury Risk Resulting From Repeat Impacts in High Humidity and Temperature",2017,"ASME 2017 …","asmedigitalcollection.asme.org","https://asmedigitalcollection.asme.org/IMECE/proceedings-abstract/IMECE2017/58363/V003T04A066/263560","",87,"2020-05-22 20:09:37","","","","",,,,,0,0.00,0,3,3,"… For reference, the AIS 4+ head injury level is defined as a “severe injury situation” that may be survivable [14 … By contrast, the flexibility of the plastic helmet shell in the side and rear regions, which have less influence from a face mask, allows for more localized loading on the EA …"
11,"CN Ross, S Austad, K Brasky, CJ Brown…","The development of a specific pathogen free (SPF) barrier colony of marmosets (Callithrix jacchus) for aging research",2017,"Aging (Albany …","ncbi.nlm.nih.gov","https://www.ncbi.nlm.nih.gov/pmc/articles/PMC5764392/","https://scholar.google.com/scholar?cites=15456627108676849750&as_sdt=2005&sciodt=0,5&hl=en",88,"2020-05-22 20:09:37","HTML","","","",,,,,11,3.67,2,5,3,"… Alterations of environmental control and medical intervention have resulted in increased survivability and plateaued mid-life survivorship [25, 26 … causes for this increased lifespan, most researchers and colony managers agree that the implementation of HEPA filtered air systems …"
0,"EM KASHIF","EXTREME COLD WEATHER CLOTHING",,"researchgate.net","","https://www.researchgate.net/profile/Kashif_Muhammad4/publication/277005461_Extreme_cold_weather_clothings/links/555d60bb08ae86c06b5dab17.pdf","",89,"2020-05-22 20:09:37","PDF","","","",,,,,0,0.00,0,1,,"… US made a latest cold weather clothing system. It is third generation ECWCS. It claims to improve survivability within broad climatic ranges. GEN III ECWCS has system features of seven levels for enhanced protection. Figure 6.5 Extended Cold Weather Clothing System …"
0,"DI Aguilar","Testing of a 1N AF-M315E Thruster",2018,"","digitalcommons.utep.edu","https://digitalcommons.utep.edu/open_etd/25/","",90,"2020-05-22 20:09:37","","","","",,,,,0,0.00,0,1,2,"… 37 Table 5.3: Effective thrust and Isp results with filtered data … As mentioned before, decomposition temperatures are extremely high and catalyst survivability is essential. There are various methods used to strengthen the mechanical properties …"
0,"ME Wood","Infectious airborne transport in individuals with cystic fibrosis and mitigation strategies to reduce aerosol dispersal",2019,"","espace.library.uq.edu.au","https://espace.library.uq.edu.au/view/UQ:1ee2211/s33233703_final_thesis.pdf?dsi_version=379007d07cbced086cd394874c2db428","",91,"2020-05-22 20:09:37","PDF","","","",,,,,0,0.00,0,1,1,"… Recent updates to CF infection control guidelines in some countries recommend the use of a surgical face mask for people with CF to minimise risk of … bacterial concentration (r=0.55, p=0.01). The surgical mask (p˂0.001), the N95 mask (p˂0.001) and …"
0,"S Gillon, C Wright, C Knott, M McPhail, L Camporota","Revision Notes in Intensive Care Medicine",2016,"","books.google.com","https://books.google.com/books?hl=en&lr=&id=hgtnDAAAQBAJ&oi=fnd&pg=PP1&dq=survivability+filtering+facepiece+respirator&ots=PDDEfpUOIv&sig=GUklGMIzakD8RwIFeaGAb8muw68","",92,"2020-05-22 20:09:37","BOOK","","","",,,,,0,0.00,0,5,4,"… fractional inspired O2 functional residual capacity Glasgow coma score glomerular filtration rate haemoglobin high … surgical procedures that significantly derange physiology are only routinely survivable with high … 14 4 Airway management 27 5 Liberation from the ventilator 32 6 …"
0,"P Poh","Effects of thermal stimuli during simulated hemorrhaging on aspects of cognitive performance",2015,"","ideals.illinois.edu","https://www.ideals.illinois.edu/handle/2142/78771","",93,"2020-05-22 20:09:37","","","","",,,,,0,0.00,0,1,5,"… major trauma is the predominant mechanism of death in potentially survivable casualties, based on each wounds potential for survivability (Eastridge et al., 2011). It is also … 0), no decrements in cognitive function (assessed by vigilance, reasoning, filtering, verbal Page 23. 16 …"
0,"S Bakshi, R Ambulkar, S Bhosale","Hypertensive Disorders in Pregnancy",2017,"… Anaesthesia Review: A …","books.google.com","https://books.google.com/books?hl=en&lr=&id=ErlEDwAAQBAJ&oi=fnd&pg=PA94&dq=survivability+filtering+facepiece+respirator&ots=pye-z9fMxJ&sig=RhKqFKdVkUEUwKUaIwV6bJoUdwU","",94,"2020-05-22 20:09:37","","","","",,,,,0,0.00,0,3,3,"… Kidney: Oliguria is a result of reduced renal perfusion and glomerular filtration. Plasma uric acid and serum creatinine are elevated … Administration of oxygen with face mask. • Left uterine displacement. • Increased hydration …"
6,"R Al-Jassim, V Sejian","Climate change and camel production: impact and contribution",2015,"J. Camelid Sci","isocard.net","http://www.isocard.net/images/journal/FILE2c81c617fad2c18.pdf","https://scholar.google.com/scholar?cites=3305282021510555089&as_sdt=2005&sciodt=0,5&hl=en",95,"2020-05-22 20:09:37","PDF","","","",,,,,6,1.20,3,2,5,"… the agriculture sector, climate change has a huge impact and threatens the survivability of poor … the combined pre-renal effects of reduced infusion with lower glomerular filtration and greatest … barley grain (3 kg/day) and CH4 emission was measured using face mask open circuit …"
0,"K Munoz","Environmental Contamination from Glove Disposal Practices",2018,"","search.proquest.com","http://search.proquest.com/openview/00aade29e66ec765383c3923ce492faa/1?pq-origsite=gscholar&cbl=18750&diss=y","",96,"2020-05-22 20:09:37","","","","",,,,,0,0.00,0,1,2,"… of their hands (Tenorio et al., 2001). Contamination happens because of its survivability on environmental surfaces and on health professionals' gloves which can spread to other … gloves, gowns, face masks/goggles, masks, respirators, etc. (CDC, 2014, nd) …"
2,"N Legband","Development of peritoneal microbubble oxygenation as an Extrapulmonary treatment for hypoxia",2017,"","digitalcommons.unl.edu","https://digitalcommons.unl.edu/mechengdiss/115/","https://scholar.google.com/scholar?cites=15003476295674914882&as_sdt=2005&sciodt=0,5&hl=en",97,"2020-05-22 20:09:37","","","","",,,,,2,0.67,2,1,3,"Page 1. University of Nebraska - Lincoln DigitalCommons@University of Nebraska - Lincoln …"
0,"GK Anderson, JD Sprick, FS Park…","Responses of cerebral blood velocity and tissue oxygenation to low‐frequency oscillations during simulated haemorrhagic stress in humans",2019,"Experimental …","Wiley Online Library","https://physoc.onlinelibrary.wiley.com/doi/abs/10.1113/EP087358","",98,"2020-05-22 20:09:37","","","","",,,,,0,0.00,0,4,1,"… setting (Kauvar, Lefering, & Wade, 2006) and 90% of potentially survivable deaths on the battlefield (Eastridge et al., 2012) … An oral/nasal cannula or face mask was used for … and resampling at 5 Hz. Data were then passed through a finite low-pass impulse response filter with …"
2,"A Kaur, GAM ten Have, B Hritzo…","Morphological and functional impairment in the gut in a partial body irradiation minipig model of GI-ARS",2020,"… Journal of Radiation …","Taylor & Francis","https://www.tandfonline.com/doi/abs/10.1080/09553002.2018.1552377","https://scholar.google.com/scholar?cites=18382289049613592194&as_sdt=2005&sciodt=0,5&hl=en",99,"2020-05-22 20:09:37","","","","",,,,,2,2.00,1,4,1,"… 2018a; 2018b) identified radiation parameters and geometry that allow survivability at GI-ARS doses … Teklad Diets, Madison, WI) twice daily and had access to triple-filtered water at … administration, the solutions were isotonic and were sterilized by 0.22 μm filtration/or autoclaving …"
0,"P Rohrbeck","Concurrent Biological, Electromagnetic Pulse, And Cyber Attacks-A Challenge To The Interagency Response",2016,"","bearworks.missouristate.edu","https://bearworks.missouristate.edu/theses/3042/","",100,"2020-05-22 20:09:37","","","","",,,,,0,0.00,0,1,4,"Page 1. BearWorks Institutional Repository MSU Graduate Theses Fall 2016 Concurrent Biological, Electromagnetic Pulse, And Cyber Attacks - A Challenge To The Interagency Response Patricia Rohrbeck As with any intellectual …"
1,"B Bouillon, D Pieper, S Flohe…","Level 3 guideline on the treatment of patients with severe/multiple injuries",2018,"… Journal of Trauma …","search.proquest.com","http://search.proquest.com/openview/d8bae5701ae2c802f0fdb6574db51115/1?pq-origsite=gscholar&cbl=38837","https://scholar.google.com/scholar?cites=14698006448136327379&as_sdt=2005&sciodt=0,5&hl=en",101,"2020-05-22 20:09:37","","","","",,,,,1,0.50,0,4,2,"Page 1. GUIDELINE Level 3 guideline on the treatment of patients with severe/multiple injuries AWMF Register-Nr. 012/019 Polytrauma Guideline Update Group © DGU (Deutsche Gesellschaft für Unfallchirurgie eV) 2018 Publisher …"
2,"CE Strobel, EK Karpinski, MA Levy, SH Davison","A modified EMS system: Transport ambulance",2016,"","digitalcommons.wpi.edu","https://digitalcommons.wpi.edu/iqp-all/1276/","https://scholar.google.com/scholar?cites=9238883341204174487&as_sdt=2005&sciodt=0,5&hl=en",102,"2020-05-22 20:09:37","","","","",,,,,2,0.50,1,4,4,"… These improvements increased the survivability of patients, and ushered in the era of modern ambulances … Even the first ambulances were a significant improvement to civilian medicine and increased patient survivability. Patients no …"
0,"MA Cubano","Emergency War Surgery, 5th US Revision",2018,"","books.google.com","https://books.google.com/books?hl=en&lr=&id=guaODwAAQBAJ&oi=fnd&pg=PT10&dq=survivability+filtering+facepiece+respirator&ots=P7V-_GSBvS&sig=I-d7lcJ9Lz_VfCBQbtcpr40gDr4","",103,"2020-05-22 20:09:37","BOOK","","","",,,,,0,0.00,0,1,2,"Page 1. Emergency War Surgery Page 2. Previous page: Hero's Highway shuts down. Airmen from the 332nd Expeditionary Medical Group carry a stretcher under the Hero's Highway flag during an aeromedical evacuation training exercise …"
1,"C Szabo","Compositions and methods to modulate angiogenesis",2017,"US Patent App. 15/082,512","Google Patents","https://patents.google.com/patent/US20170049809A1/en","https://scholar.google.com/scholar?cites=10775029215160016876&as_sdt=2005&sciodt=0,5&hl=en",104,"2020-05-22 20:09:37","","","","",,,,,1,0.33,1,1,3,"… μM or 60 μM NaHS) or vehicle (control) at 37° C. Non-migrated cells at the top of the transwell filter were removed … It was shown that treatment with sulfide and other chalcogenides induces stasis and enhances survivability of biological matter and protects biological matter from …"
0,"AE Johns","Lessons for Plant Micropropagation",2019,"","books.google.com","https://books.google.com/books?hl=en&lr=&id=GyGBDwAAQBAJ&oi=fnd&pg=PA1&dq=survivability+filtering+facepiece+respirator&ots=h3wCH2FEGO&sig=IPGBxJGnUbBg8tGtPRZdjCEyOmY","",105,"2020-05-22 20:09:37","BOOK","","","",,,,,0,0.00,0,1,1,"… Manipulation of the plant tissue must typically be carried out in a sterile room or in a filtered air environment like laminar air flow cabinet … For large volumes, filter sterilization can be carried out using a vacuum filtering set up …"
0,"LIT Center","Trauma Guidelines",2018,"","med.stanford.edu","http://med.stanford.edu/content/dam/sm/scalpel/documents/GoalsAndObj/Stanford_Trauma_Guidelines.2018-adult-and-peds.pdf","",106,"2020-05-22 20:09:37","PDF","","","",,,,,0,0.00,0,1,2,"… 84 Management Severe TBI 85 ICP Management 86 Richmond Agitation Scale (RASS) 87 ARDS Ventilator Management 88 Empiric Antibiotics in the SICU – Pneumonia 89 Empiric Antibiotics in the SICU – Abdominal INFX 90 Empiric Antibiotics in the SICU – Line Infections …"
1,"European Journal of Trauma and Emergency Surgery","Level 3 guideline on the treatment of patients with severe/multiple injuries: AWMF Register-Nr. 012/019",2018,"Springer","","https://link.springer.com/article/10.1007/s00068-018-0922-y","https://scholar.google.com/scholar?cites=321479901413014760&as_sdt=2005&sciodt=0,5&hl=en",107,"2020-05-22 20:09:37","HTML","","","",,,,,1,0.50,1,1,2,""
0,"PGU Group","Level 3 guideline on the treatment of patients with severe/multiple injuries: AWMF Register-Nr. 012/019",2018,"European Journal of Trauma and Emergency …","ncbi.nlm.nih.gov","https://www.ncbi.nlm.nih.gov/pmc/articles/PMC7095955/","",108,"2020-05-22 20:09:37","HTML","","","",,,,,0,0.00,0,1,2,""
2,"C Emerson","100 Deadly Skills: Survival Edition: The SEAL Operative's Guide to Surviving in the Wild and Being Prepared for Any Disaster",2016,"","books.google.com","https://books.google.com/books?hl=en&lr=&id=qrg9DQAAQBAJ&oi=fnd&pg=PP13&dq=survivability+filtering+facepiece+respirator&ots=84rI6oODJ1&sig=y2VYHMGQsJy8YmUTPCMhzsDwhwI","https://scholar.google.com/scholar?cites=13631275685721614102&as_sdt=2005&sciodt=0,5&hl=en",109,"2020-05-22 20:09:37","BOOK","","","",,,,,2,0.50,2,1,4,"… and Scavenge Desert Survival Food 60 025 Build a Cooling Desert Shelter 62 026 Minimum EDC, Wetland Environment 64 027 Filter Water in a … OO1 BeCOme Crisis Proof Survivability isn't just a matter of carrying the right tools or follow- ing the most punishing physical training …"
0,"JR Schab, MW Schab, RM Bowen…","Mobile Animal Surveillance and Distress Monitoring",2019,"US Patent App. 16 …","Google Patents","https://patents.google.com/patent/US20190059338A1/en","",110,"2020-05-22 20:09:37","","","","",,,,,0,0.00,0,4,1,"… Accordingly, improvements are sought in the wearability and survivability of such systems … general physiologic state of the animal, and are used as a first-level filter to identify … differentiating between the respiratory rhythm data and the cardiac rhythm data by filtering and principal …"
0,"M El Khoury","The Effects of Heat and Explosions on Forensic DNA Analyses",2019,"","leicester.figshare.com","https://leicester.figshare.com/articles/The_Effects_of_Heat_and_Explosions_on_Forensic_DNA_Analyses/11798913/files/21531654.pdf","",111,"2020-05-22 20:09:37","PDF","","","",,,,,0,0.00,0,1,1,"Page 1. The Effects of Heat and Explosions on Forensic DNA Analyses Thesis submitted for the degree of Doctor of Philosophy at the University of Leicester by Marwan El Khoury Department of Genetics and Genome Biology March 2019 Page 2. i i …"
0,"R Wood","Experimental and Theoretical Studies of Contaminant Transport Due to Human Movement in a Hospital Corridor",2015,"","etheses.whiterose.ac.uk","http://etheses.whiterose.ac.uk/id/eprint/11785","",112,"2020-05-22 20:09:37","","","","",,,,,0,0.00,0,1,5,"… 53 3.5 (a) A false coloured image of only water in the tank and the corresponding transformation into individual contour regions once the spatial filter is applied; (b) Typical series of calibration curves. Note that the number of curves shown has been reduced for clarity …"
15,"I Sutton","Plant design and operations",2017,"","books.google.com","https://books.google.com/books?hl=en&lr=&id=fgOqDQAAQBAJ&oi=fnd&pg=PP1&dq=survivability+filtering+facepiece+respirator&ots=46iwCgL8mt&sig=rTTWCqmSbtt6FTQizbFzlA9y54U","https://scholar.google.com/scholar?cites=6091023562292602662&as_sdt=2005&sciodt=0,5&hl=en",113,"2020-05-22 20:09:37","BOOK","","","",,,,,15,5.00,15,1,3,"Page 1. PLANT DESIGN AND OPERATIONS |AN SUT ION SECOND EDITION Page 2. Plant Design and Operations Page 3. This page intentionally left blank Page 4. Plant Design and Operations Second Edition Ian Sutton Author, Sutton Technical Books, Ashland, Virginia …"
0,"S Drexler","Mindful Awareness of Internal and External Influences on High Reliability Organization Leaders: A Heuristic Inquiry",2018,"","search.proquest.com","http://search.proquest.com/openview/2909cc3cec6e36979b6076447bdd1d0d/1?pq-origsite=gscholar&cbl=18750&diss=y","",114,"2020-05-22 20:09:37","","","","",,,,,0,0.00,0,1,2,"… mindfulness and increasing HRO leader well-being and survivability in dangerous situations. Page 5. iv … steadfastly into my face mask as he gave the thumbs up sign. He gestured towards the … decisions by rapidly filtering ambiguous information, sorting through mental models …"
1,"JL Ogdee","Potential distributional spread of the zoonotic parasite, Baylisascaris procyonis, by raccoons within southern Texas",2015,"","search.proquest.com","http://search.proquest.com/openview/1771f8f85a815e27a4931854bf851fac/1?pq-origsite=gscholar&cbl=18750&diss=y","https://scholar.google.com/scholar?cites=16592265536290736835&as_sdt=2005&sciodt=0,5&hl=en",115,"2020-05-22 20:09:37","","","","",,,,,1,0.20,1,1,5,"Page 1. POTENTIAL DISTRIBUTIONAL SPREAD OF THE ZOONOTIC PARASITE, BAYLISASCARIS PROCYONIS, BY RACCOONS WITHIN SOUTHERN TEXAS A Thesis by JACOB LOUIS OGDEE Submitted to the College of …"
1,"SC Segall","Multi-junctional bleeding simulator",2018,"US Patent App. 15/859,112","Google Patents","https://patents.google.com/patent/US20180190155A1/en","https://scholar.google.com/scholar?cites=11184353519600925612&as_sdt=2005&sciodt=0,5&hl=en",116,"2020-05-22 20:09:37","","","","",,,,,1,0.50,1,1,2,"US20180190155A1 - Multi-junctional bleeding simulator - Google Patents. Multi-junctional bleeding simulator. Download PDF Info. Publication number US20180190155A1. US20180190155A1 US15/859,112 US201715859112A …"
0,"FCS Whitfield II","FIREFIGHTER FATALITY INVESTIGATION",,"tdi.texas.gov","","https://tdi.texas.gov/reports/fire/documents/fmfffwhitfield.pdf","",117,"2020-05-22 20:09:37","PDF","","","",,,,,0,0.00,0,1,,"… When cadets' turn comes up, they gear up in full PPE (pants, coat, boots, gloves, face-piece, hood, helmet, and SCBA) and connect the regulator to their mask. Each trainee is given 30 minutes to complete the course. The cadets are instructed to unplug the regulator from …"
0,"F Cabana","Using feeding ecology to influence captive Slow Loris (Nycticebus spp.) nutrition and husbandry",2016,"","radar.brookes.ac.uk","https://radar.brookes.ac.uk/radar/file/f914ce25-53fc-45b6-a8f2-1646aa38acff/1/cabana2016usingRADAR.pdf","",118,"2020-05-22 20:09:37","PDF","","","",,,,,0,0.00,0,1,4,"… increases), lack of dietary gum may lead to health issues and in turn impact the breeding and survivability of captive populations (eg Cabana and Nekaris 2015). Conversely, reduced gum intake for opportunistic gummivores should result in minimal impact …"
0,"FS Deem","FIREFIGHTER FATALITY INVESTIGATION",,"adaptovercometraining.com","","https://www.adaptovercometraining.com/s/fffsadeem.pdf","",119,"2020-05-22 20:09:37","PDF","","","",,,,,0,0.00,0,1,,"Page 1. S T A T E F IRE MARSHAL'S O F F IC E Prevent • Educate • Protect 1910 FIREFIGHTER FATALITY INVESTIGATION Firefighter Scott Deem San Antonio Fire Department Investigation FFF FY 17-02 San Antonio, Texas • May 18, 2017 Page 2. State Fire Marshal's Office …"
5,"S Sahu","Survival and Yield of Rangeeni Lac insect on Butea monosperma (Lam) treated with different Micronutrients and Humic acid",2016,"M. sc.(Ag) Thesis, submitted, JNKVV, Jabalpur","pdfs.semanticscholar.org","https://pdfs.semanticscholar.org/23ca/536a1c9f31b2646f3af65780eb6d99ffdf63.pdf","https://scholar.google.com/scholar?cites=4700660244742361647&as_sdt=2005&sciodt=0,5&hl=en",120,"2020-05-22 20:09:37","PDF","","","",,,,,5,1.25,5,1,4,"… will promote vegetative growth of the horticulture plant. Highest survivability of K. lacca on the Z. mauritiana treated with NPK may … and rate of filtration; and increase in colour index and hot alcohol insolubles of Page 15. lac resin during storage …"
0,"M Noone","How to Become an International Disaster Volunteer",2017,"","books.google.com","https://books.google.com/books?hl=en&lr=&id=HAJQCwAAQBAJ&oi=fnd&pg=PP1&dq=survivability+filtering+facepiece+respirator&ots=kR66BKDEF5&sig=7Yj-_XFh5Exi5XDRZQtje7n8b1Q","",121,"2020-05-22 20:09:37","BOOK","","","",,,,,0,0.00,0,1,3,"Page 1. HOW to Become an International Disaster Volunteer Michael Noone Page 2. How to Become an International Disaster Volunteer Page 3. This page intentionally left blank Page 4. How to Become an International Disaster Volunteer Michael Noone Page 5 …"
0,"J Cannon","Combining the Fantastic and the Hyper-Real: Stylistic and Thematic Influences on the Dead and the Desert",2016,"","dash.harvard.edu","https://dash.harvard.edu/handle/1/33797265","",122,"2020-05-22 20:09:37","","","","",,,,,0,0.00,0,1,4,"… Surely new technology and the fact that Coalition forces at least nominally controlled the country would make such a situation unlikely and infinitely more survivable. So I asked myself, what more could I, as a writer, add to the enormous array of hardships these men might face …"
1,"P Vishwakarma, HA Upendra, S Isloor…","Evaluation of Therapeutic Efficacy of Immunoglobulins in Visceral Gout affected Broiler chicks",2015,"Parameters","kvafsu.edu.in","http://kvafsu.edu.in/fjvas/fjvas_4_1_15_articles.pdf","https://scholar.google.com/scholar?cites=7217807325018148610&as_sdt=2005&sciodt=0,5&hl=en",123,"2020-05-22 20:09:37","PDF","","","",,,,,1,0.20,0,4,5,"… It was further observed that, the chances of the lamb surviving were almost zero when the birth weight of the lamb was less than 1300 g. The results of the present study revealed that, NARI Suwarna ewes is indeed a very high prolific breed but the survivability of the lambs is …"
0,"R Mandel","The Global Illusion of Citizen Protection: Transnational Threats and Human Security",2018,"","books.google.com","https://books.google.com/books?hl=en&lr=&id=E-XaDwAAQBAJ&oi=fnd&pg=PP1&dq=survivability+filtering+facepiece+respirator&ots=0P9kEYBjvs&sig=wwRfkRajvJHCxSY3sUswYfKg_yI","",124,"2020-05-22 20:09:37","BOOK","","","",,,,,0,0.00,0,1,2,"Page 1. ||ron snction C. Thrects Cnd HUnion Security The G|ObC |||Usion of Citizen Protect iOn ee º e - eeeeeeeeeeeeeeeeeeee eeeeeeeeeeeeeeeeeeee eeeeee ee - eeeeeeeeeeeeeeeeeeee eeeeeeeeeeeeeeeeeeee eeeeeeeee Page 2 …"
0,"MM Dinh","CHAPTER FOURTEEN",2016,"SCOPE AND OUTCOMES OF A TRAUMA …","ses.library.usyd.edu.au","https://ses.library.usyd.edu.au/bitstream/handle/2123/16470/rdinh_mmq_thesis_phd_Redacted.pdf?sequence=5&isAllowed=y#page=195","",125,"2020-05-22 20:09:37","PDF","","","",,,,,0,0.00,0,1,4,"… The program of work outlined in this thesis were directed at improving survivability after severe injury, but inclusion of these and other measures of … This is currently facilitated in NSW by the inclusion of standard American College of Surgeon-based audit filters into the State-wide …"
